id,text,label,event
553225359928213505,White terrorists are 'mentally ill'  while brown terrorists are 'Islamic assassins'. #NAACPBombing #CharlieHebdo http://t.co/idMCYFtIbh,0,charliehebdo-all-rnr-threads
553225402282692608,#CharlieHebdo: If we talk about ‘war’  we fall into the trap set by murderers  @robinlustig http://t.co/dbBJUkm0sR http://t.co/IqouaAdFxx,0,charliehebdo-all-rnr-threads
553225701701066752,Political cartoonists are mourning #CharlieHebdo by retaliating the only way they know how. On pen and paper. http://t.co/0GLdlkk5ja,0,charliehebdo-all-rnr-threads
553225809444749313,Charlie Hebdo will print 1 million copies of next issue. http://t.co/AsJqXcoKAP #JeSuisCharlie http://t.co/HzQKnNo7FC,0,charliehebdo-all-rnr-threads
553225828625297408,Here are some short profiles of the four cartoonists who were killed yesterday at Charlie Hebdo: http://t.co/q0cPbnxtBz,0,charliehebdo-all-rnr-threads
553226059836297216,What 14 British Muslims think about the Charlie Hebdo attack http://t.co/LDERW9d1LN http://t.co/KiT0OduVsC,0,charliehebdo-all-rnr-threads
553226143307161600,“They won’t kill freedom.” Europe's newspapers respond to #CharlieHebdo attack http://t.co/k2qcl4QjbQ http://t.co/LcVR20LFJx,0,charliehebdo-all-rnr-threads
553227220765130752,A 60-second tribute to the victims of the #CharlieHebdo attack http://t.co/SNQBRuh48T http://t.co/WFYN11sijj,0,charliehebdo-all-rnr-threads
553227238829981698,How can you defend anyone's rights if they chop off your head? Tolerance of intolerance is cowardice! #CharlieHebdo http://t.co/KAtF0DfVEO,0,charliehebdo-all-rnr-threads
553227258782306304,So heartbroken for France...thinking of all my French friends across the sea today #JeSuisCharlie http://t.co/LkRSIyVsCC,0,charliehebdo-all-rnr-threads
553227288859664384,#JeSuisCharlie in numbers http://t.co/FTkljHIEpw,0,charliehebdo-all-rnr-threads
553227389061582848,Anti-terror police close in on #CharlieHebdo suspects in tiny French village http://t.co/Sj4HijDF9f http://t.co/0xwZI3uUtq,0,charliehebdo-all-rnr-threads
553227441712668672,And do it GoT style  please RT @GRRM: Life advice. #JeSuisCharlie http://t.co/riVYZW5ZIh,0,charliehebdo-all-rnr-threads
553227856046596097,In the wake of #CharlieHebdo attack  let's not sacrifice even more rights https://t.co/DZoVYASb9V,0,charliehebdo-all-rnr-threads
553227906449960961,#BREAKING IS radio praises Charlie Hebdo attackers as 'heroes',0,charliehebdo-all-rnr-threads
553228537084116993,15 Cartoons From Artists Responding to #ParisShooting http://t.co/AZk7gGeuAb #CharlieHebdo #freespeech Please RT! http://t.co/EMlnyvBGUK,0,charliehebdo-all-rnr-threads
553229177055219713,Just shameful RT Lifenews: the terrorist Attack in Paris organized by the US Intelligence  http://t.co/X5EvkYDl1U http://t.co/jAhDDk82Sa,0,charliehebdo-all-rnr-threads
553229592480481281,Charlie Hebdo will publish one million copies next week with help from Google http://t.co/e1TKBbVpwl http://t.co/1ThluwbhVq,0,charliehebdo-all-rnr-threads
553229626756329472,'Stupidity will not win' - Survivors of #CharlieHebdo attack will publish new issue next week http://t.co/Nj2I6Toy2j http://t.co/GanDakkrwE,0,charliehebdo-all-rnr-threads
553229808260632578,One victim killed in the attack on Charlie Hebdo was a Muslim policeman  Ahmed Merabet.,0,charliehebdo-all-rnr-threads
553229948153262081,'We must be aware that our best weapon is our unity. Nothing must divide  oppose or separate us'   Francois Hollande  #JeSuisCharlie,0,charliehebdo-all-rnr-threads
553229956830875650,Muslim leaders worldwide have condemned the Charlie Hebdo attacks. But you won't learn that by watching @FoxNews. http://t.co/Io6mrpxvb3,0,charliehebdo-all-rnr-threads
553230256992423936,How cartoonists around the world responded to the Charlie Hebdo attack http://t.co/alxmVb4EU0 http://t.co/9KXhtkFNZW,0,charliehebdo-all-rnr-threads
553231516290269184,Pictures From #CharlieHebdo Solidarity Vigils Across The Globe http://t.co/PwIlxlQEuD http://t.co/dgR5c4Tr6m,0,charliehebdo-all-rnr-threads
553231607449276416,#JeSuisCharlie  Hey folks  enter for free paypal sums ! http://t.co/lIlT8irzFy,0,charliehebdo-all-rnr-threads
553231667523883009,Funny how #KillAllChristians wasn't trending when Anders Breivak murdered 77 innocent souls.  #JeSuisCharlie http://t.co/ol8OZugnV1,0,charliehebdo-all-rnr-threads
553232137931849728,Charlie Hebdo to Print 1 Million Copies in Defiance After Attack http://t.co/2kvfnSm5oI via @business,0,charliehebdo-all-rnr-threads
553232531827740672,This morning in France  anti-Muslim terrorists threw 2 or 3 grenades into a mosque No injuries http://t.co/8WKHxSO92b http://t.co/LJiPciR6Hm,0,charliehebdo-all-rnr-threads
553232704708546561,The Eiffel Tower will go dark at 8 p.m. local time in Paris in remembrance of the Charlie Hebdo victims http://t.co/cfEJFkxnM8,0,charliehebdo-all-rnr-threads
553233130275221504,To those who believe terror works - the Charlie Hebdo print run for next week's issue increased from its usual 60 000 copies to one million.,0,charliehebdo-all-rnr-threads
553233414145310720,On the one hand Saudi denounces attack on #CharlieHebdo on other it condemns @raif_badawi to 10 years and 1000 lashes for insulting Islam!!,0,charliehebdo-all-rnr-threads
553234578086055937,Cartoonists don't deserve death for artwork. But I am not #CharlieHebdo. Their racist content doesn't become courageous because ppl died.,0,charliehebdo-all-rnr-threads
553235271169638400,Washington USA Seattle → http://t.co/xPvOBDBRHv #CharlieHebdo 666 Satirical Newspaper Charlie Hebdo Braved Earlier Attack And Threats Befor…,0,charliehebdo-all-rnr-threads
553235360722214912,Everytime a satirist is murdered  1 000 more satirists rise up to take their place.  #JeSuisCharlie,0,charliehebdo-all-rnr-threads
553236009081921536,Iran condemns #CharlieHebdo massacre?! What about this man on death row... for blogging! http://t.co/H1Kbn2AltW http://t.co/wSeuOMPtuf,0,charliehebdo-all-rnr-threads
553461741917863936,Rural region of northern France searched in hunt for #CharlieHebdo gunmen - latest updates http://t.co/7iVIN3nqCv http://t.co/YrdUIOjrZF,1,charliehebdo-all-rnr-threads
553462249562832897,The Eiffel Tower went dark Thursday evening to honor victims of #CharlieHebdo attack: http://t.co/MTOkoGt8RL http://t.co/rmEbItK2Og,0,charliehebdo-all-rnr-threads
553463773844238337,Steve Bell on the Charlie Hebdo attackers – cartoon http://t.co/OkFs66mAmX http://t.co/jDclFGrzXD,0,charliehebdo-all-rnr-threads
553464709899616257,→ http://t.co/pPmyRFcU8h 55 Why was Charlie Hebdo magazine targeted in the Paris shooting? #CharlieHebdo In February… http://t.co/6ZRAsHZL0Q,0,charliehebdo-all-rnr-threads
553466755411369985,"""State surveillance of emails will prevent a #CharlieHebdo atrocity.""  - But France already has email surveillance.  ""Let's have it anyway.""",0,charliehebdo-all-rnr-threads
553467311261503488,Reports of shooting at  Dammartin en Goele on route N2 north east of Paris - French media says car chase under way,1,charliehebdo-all-rnr-threads
553468492700454912,BREAKING NEWS - Exchange of fire reported in #DammartinEnGoele  http://t.co/2A0s2WxBmZ #CharlieHebdo http://t.co/FuysX2plAj,1,charliehebdo-all-rnr-threads
553468593141469184,THIS: RT @LatuffCartoons: let's talk seriously about #CharlieHebdo &amp; Western double standard on freedom of speech http://t.co/r7zBacbndM,0,charliehebdo-all-rnr-threads
553469263650906112,This is a terrorist  this is a Muslim: French envoy’s #CharlieHebdo @twitter photo goes viral http://t.co/Eq0zDMEHEA http://t.co/NWS09tFi8k,0,charliehebdo-all-rnr-threads
553469523945590784,Reports of shots fired north-east of Paris as French police pursue two suspected Charlie Hebdo gunmen in car chase http://t.co/FbUYubJDOY,1,charliehebdo-all-rnr-threads
553469733656203264,#BREAKING Hostages taken north-east of Paris: police,1,charliehebdo-all-rnr-threads
553470140042735616,BREAKING NEWS: Shots Fired  Hostages Taken in Town Northeast of Paris http://t.co/cvtBTLqc6e,1,charliehebdo-all-rnr-threads
553470733180223489,Breaking: Shots fired northeast of Paris involving men believed to be Charlie Hebdo suspects http://t.co/tYCeEMKwOo,1,charliehebdo-all-rnr-threads
553470907629707266,"Bill Maher: ""Hundreds of millions"" of Muslims ""support attacks like this"" http://t.co/Tb1lS1uqKA #CharlieHebdo http://t.co/0ZCduOwpJl",0,charliehebdo-all-rnr-threads
553470977972375553,BREAKING: Reports of shots fired  hostages taken in town Northeast of Paris http://t.co/f30TSVt1yN http://t.co/jeuTP0IOZg,1,charliehebdo-all-rnr-threads
553471193110421504,Hostages have reportedly been taken as police pursue gunmen responsible for the #ParisAttack http://t.co/RkQMx9cijy http://t.co/CilbwL4ewF,1,charliehebdo-all-rnr-threads
553471987411324929,BREAKING: Gunfire  hostages taken in Dammartin-en-Goële  east of Paris  as police chase suspected #CharlieHedbo attackers,1,charliehebdo-all-rnr-threads
553472225798795264,BREAKING: Gunfire reported in French town as police hunt suspects in #CharlieHebdo attack | More soon at: http://t.co/SIQeukZutl,1,charliehebdo-all-rnr-threads
553472437644320769,BREAKING: French police chasing a Peugeot on motorway around Paris and say hostages have been taken by Cahrlie Hedbo attack gunmen.,1,charliehebdo-all-rnr-threads
553472488462901248,Police vehicles chase #CharlieHebdo suspects on French motorway http://t.co/k3G8Y2jdE8 http://t.co/MBUxnx3KRv,1,charliehebdo-all-rnr-threads
553473416905629696,Convoy of police cars rushing toward town northeast of Paris amid reports of hostages taken - @FRANCE24 broadcast http://t.co/ZFJYh80uxy,1,charliehebdo-all-rnr-threads
553473550523580416,#BREAKING - #FRANCE: Hostages taken at company North-East of #Paris https://t.co/4yt6nafpIg #CharlieHebdo http://t.co/DPPbKD3RUk,1,charliehebdo-all-rnr-threads
553473559352606720,Boko Haram killed 2000 people in Baga over a period of 5 days. No  that won't make news like #CharlieHebdo because this is Africa lad.,0,charliehebdo-all-rnr-threads
553473629854646272,I know a guy that feels really weird hearing all this media fountain about European freedom of speech. #CharlieHebdo http://t.co/1IqtP6jE9M,0,charliehebdo-all-rnr-threads
553473704060284928,BREAKING NEWS: Reports of shots fired  car chase northeast of Paris as French police hunt Charlie Hebdo attackers. http://t.co/yRb5bP0YV1,1,charliehebdo-all-rnr-threads
553474012446478336,France's interior minister says operation to detain Charlie Hebdo suspects is now underway northeast of Paris - @AP http://t.co/ZFJYh80uxy,1,charliehebdo-all-rnr-threads
553474188259102720,BREAKING: Shots fired  hostages taken in manhunt for #CharlieHebdo attackers  police say http://t.co/omBy6Wsgb7 http://t.co/ZbszAHyIzJ,1,charliehebdo-all-rnr-threads
553474232596701184,#BREAKING: Reports hostage situation underway north-east of Paris http://t.co/COe8YbNp2M #CharlieHebdo http://t.co/GpbstHfKEc,1,charliehebdo-all-rnr-threads
553475269873643520,MORE: Operation to detain massacre suspects unfolding in Dammartin-en-Goele  about 25 miles northeast of Paris: http://t.co/H1bHg5T7Ec,1,charliehebdo-all-rnr-threads
553475430897156096,DETAILS: Car chase in norhteastern France  hostages taken by #CharlieHebdo suspects http://t.co/G6eunBDIrj http://t.co/sWDOsIfEnP,1,charliehebdo-all-rnr-threads
553475729187680258,BREAKING: Car chase under way in Paris as officers pursue #CharlieHebdo suspects down motorway http://t.co/f30TSVt1yN http://t.co/1ShVASm5ym,1,charliehebdo-all-rnr-threads
553475824369012736,Two people reportedly seriously hurt in a shootout in the hunt for the #ParisAttack gunmen http://t.co/CVcFrESdld http://t.co/8EmDi6eZL3,1,charliehebdo-all-rnr-threads
553476073703620609,BREAKING: French police convoy  helicopters rush to scene of operation to detain #CharlieHebdo shooting suspects  AP says,1,charliehebdo-all-rnr-threads
553476288103477249,UnReal Toon: #CharlieHebdo's cartoonists in great demand  (via @sagarcartoonist  with @ajayendar) http://t.co/KKF0DgCnL4,0,charliehebdo-all-rnr-threads
553476471470432256,Reports in French media of hostage situation as manhunt for #CharlieHebdo suspects centres on #DammartinEnGoele http://t.co/PNhWZP39md,1,charliehebdo-all-rnr-threads
553476490315431937,Police convoy and helicopters are rushing to scene to detain Charlie Hebdo massacre suspects http://t.co/XdUgohNDhv http://t.co/MSROYqs14o,1,charliehebdo-all-rnr-threads
553477352542707712,Breaking: Police suspect gunmen have taken one hostage  after shots were fired involving Charlie Hebdo suspects http://t.co/FYkXChPD4d,1,charliehebdo-all-rnr-threads
553477554041257985,Report: Hostages taken at a printing shop northeast of Paris; some injuries - @FRANCE24 broadcast http://t.co/hasCHjOVnC,1,charliehebdo-all-rnr-threads
553477692591726592,BREAKING: At least one killed  severeal injured during shootout with #CharlieHebdo attack suspects - local media http://t.co/G6eunBDIrj,1,charliehebdo-all-rnr-threads
553477943616634880,Update - Reuters reports at least one person killed &amp; several injured in shootout before hostage-taking in Dammartin-en-Goele in France,1,charliehebdo-all-rnr-threads
553478014785187840,I say the following as an atheist.  I'm sick &amp; tired of double standard #Muslims face. #CharlieHebdo #JeSuisCharlie http://t.co/kpMtzthr9I,0,charliehebdo-all-rnr-threads
553478142791548928,Breaking News: Reports of Gunfire and Hostage in Search for Suspects in Paris Attack http://t.co/U8BE162qls,1,charliehebdo-all-rnr-threads
553478289474740224,#BREAKING : 1 dead  several injured in shootout North-East of Paris (French radio @RTLFrance ) http://t.co/LdSF5QeCiv #CharlieHebdo,1,charliehebdo-all-rnr-threads
553478677359775744,Scene at #DammartinEnGoele as police hunt #CharlieHebdo suspects - follow our coverage: http://t.co/HvWOnQGf9x http://t.co/NW8RB0E0kY,1,charliehebdo-all-rnr-threads
553479315711864832,→ http://t.co/qmWa9qgRrg Charlie Hebdo attack: Hunt for killers focuses on northern France #CharlieHebdo 485 http://t.co/akSz683KbY,1,charliehebdo-all-rnr-threads
553479401296625664,Charlie Hebdo cartoonist Wolinski’s daughter: ‘I don’t think you can kill ideas’ http://t.co/7nWOgz3zs1,0,charliehebdo-all-rnr-threads
553480082996879360,Reports of fatality and injuries following shootout ahead of Dammartin-en-Goele hunt - live coverage: http://t.co/JM4ot03Ge5 #CharlieHebdo,1,charliehebdo-all-rnr-threads
553480257747963905,Why #CharlieHebdo attack outrages me yet I won't publish its cartoons. Why I'd defend #PK but ask MF Husain questions http://t.co/2s4nugBYq7,0,charliehebdo-all-rnr-threads
553480287045554176,"Apple  the ""Je suis Charlie"" banner on your french site is pointless: host Charlie Hebdo on your kiosk for free _NOW_ And stop censorship.",0,charliehebdo-all-rnr-threads
553480292498153472,#ChalieHebdo terrorists are held up in a warehouse with hostages. #JeSuisCharlie http://t.co/AJYsqfKMwa,1,charliehebdo-all-rnr-threads
553480333954678784,In case you are confused…#CharlieHebdo @lucasofri  (via @disinformatico) http://t.co/Dme3G2FLkJ,0,charliehebdo-all-rnr-threads
553480702067736578,Shots fired and hostages taken in a building east of Paris as police hunt #CharlieHebdo attackers http://t.co/GFdUI2rwlN,1,charliehebdo-all-rnr-threads
553481076916883456,BREAKING: Hostage taken after Charlie Hebdo suspects sighted north of Paris http://t.co/nXWWIfklMi,1,charliehebdo-all-rnr-threads
553481335948709888,A powerful @NewYorker front cover : #CharlieHebdo http://t.co/kPSyaXloH2,0,charliehebdo-all-rnr-threads
553481963864993792,Did they draw cartoons? #JeSuisCharlie RT @Leandriii: Why no outrage for the 100s of people Boko Haram wiped out yesterday?,0,charliehebdo-all-rnr-threads
553483415954411520,What we know so far about the major operation northeast of Paris #CharlieHebdo http://t.co/GWpwcdfIJA http://t.co/UpeKOm4WCN,1,charliehebdo-all-rnr-threads
553483707122995201,They should stop making attacks they are giving a bad image to Islam  #CharlieHebdo http://t.co/S6gj7aAoYc,0,charliehebdo-all-rnr-threads
553483906096185345,RT @Yair_Rosenberg: Um  the International Business Times is running a piece blaming #CharlieHebdo attack on Israel http://t.co/2ndLXiupSP h…,0,charliehebdo-all-rnr-threads
553484365012148225,Operation underway in the Dammartin-en-Goele area  as police hunt Paris shooting suspects  French interior minister tells CNN affiliate.,1,charliehebdo-all-rnr-threads
553484530804613120,"Arsene Wenger: ""To think in a country like France you can die for your ideas is absolutely shocking."" #JeSuisCharlie",0,charliehebdo-all-rnr-threads
553484780093050880,Gendarmerie arrive at the hostage taking in Dammartin-en-Goele. Latest: http://t.co/7N7uvClhWY (Pic:Martmann/Reuters) http://t.co/kntlzzmvHm,1,charliehebdo-all-rnr-threads
553485452943302656,BREAKING: French police: Suspects in newspaper attack appear to have taken a hostage northeast of Paris,1,charliehebdo-all-rnr-threads
553485654030446592,So all you #JeSuisCharlie sheep  you make me sick  condemn the killings but don't make heroes and martyrs out of the racist idiots.,0,charliehebdo-all-rnr-threads
553485866346483713,48 hrs  &amp; Paris makes #CharlieHebdo honorary citizen. 20 mths &amp; our craven elites won’t even name a Lee Rigby memoral for fear of “offence”.,0,charliehebdo-all-rnr-threads
553486439129038848,BREAKING: French police tell AP suspects in #CharlieHebdo attack have taken a hostage northeast of Paris.,1,charliehebdo-all-rnr-threads
553486529231089664,#BREAKING Paris massacre suspects holding one hostage: police source,1,charliehebdo-all-rnr-threads
553486601146617856,In case you are confused. Check who's the terrorist and who's the #Muslim. #JeSuisCharlie #JeSuisAhmed http://t.co/WSq17Z1TQb,0,charliehebdo-all-rnr-threads
553486796534054912,Meaux hospital sent medical team to reported hostage scene northeast of Paris  hospital communications director says. http://t.co/vncToPmhMX,1,charliehebdo-all-rnr-threads
553487579077550082,Hundreds of massacres committed daily against muslims in Burma and nobody says a word  #CharlieHebdo #JeSuisCharlie http://t.co/r2qkysjVDw,0,charliehebdo-all-rnr-threads
553487625815064576,Stop today's flogging of @raif_badawi @UKinSaudiArabia. You Can't 'condemn' Charlie hebdo attack yet flog/imprison freethinkers! #FreeRaif,0,charliehebdo-all-rnr-threads
553487971497041920,Schools close  people told to stay indoors amid Dammartin-en-Goele #CharlieHebdo manhunt  http://t.co/D8ZTxcCaK5 http://t.co/juVYYleAJ4,1,charliehebdo-all-rnr-threads
553488054640340992,Latest on the manhunt for Charlie Hebdo attackers: http://t.co/JfmqW07Vhk http://t.co/mjiiPM2gHG,1,charliehebdo-all-rnr-threads
553488824656203776,Schools closed  Dammartin-en-Goele residents told to stay indoors  town 'like warzone' http://t.co/G6eunBDIrj http://t.co/FAtmW7d3xk,1,charliehebdo-all-rnr-threads
553488850363101184,Analysis: The story of the police officer killed in the #CharlieHebdo attack is no longer in the headlines - why? | http://t.co/kpQmgkbjhg,0,charliehebdo-all-rnr-threads
553489393202499584,Paris Murder Suspects Cornered with Hostage http://t.co/yzHJi4Hw54,1,charliehebdo-all-rnr-threads
553489837542899712,While the West fought foreign wars  we ignored the threat from within our own societies says @Nigel_Farage  http://t.co/cJ8lyelD5U,0,charliehebdo-all-rnr-threads
553490238979727360,MORE: Massacre suspects believed to have taken hostage and holed up in small industrial town northeast of Paris: http://t.co/lmr2ImJhmr,1,charliehebdo-all-rnr-threads
553490241445965824,After the awful attack on #CharlieHebdo  France should set example of tolerance  protect Muslims from reprisals http://t.co/aV3l4SLt7H,0,charliehebdo-all-rnr-threads
553490358748061696,French police asking media to not broadcast live images at scene of Paris hostage situation so police locations are not revealed. (@BNONews),0,charliehebdo-all-rnr-threads
553491005971132416,More than 80 000 police officers are involved in search for #CharlieHebdo suspects Cherif and Said Kouachi. http://t.co/qB4b5cKvPg,0,charliehebdo-all-rnr-threads
553491517462315008,9/11 attacks  London 7/7 bombings  Madrid  Boston Marathon  Fort Hood  Paris  Oklahoma Beheading... but we're not supposed 2 question Islam?,0,charliehebdo-all-rnr-threads
553491540535156736,#CharlieHebdo latest: - 2 gunmen believed holed up in building - reports of 1 hostage  - Shots fired in car chase http://t.co/Xl5uwqHQta,1,charliehebdo-all-rnr-threads
553491604917334016,The Prophet PBUH never killed anyone for blasphemy. There is no justification is #Islam for #CharlieHebdo murders. Trend #MuslimsForPeace,0,charliehebdo-all-rnr-threads
553491924015783936,Journalists in Beijing gather for #JeSuisCharlie photo. Police are not pleased http://t.co/JzgjhtaD88 (AFP) http://t.co/RKBmlSDygM,0,charliehebdo-all-rnr-threads
553493222052605952,DEVELOPING: #CharlieHebdo shooting suspects holed up in premises of construction company http://t.co/G6eunBDIrj http://t.co/Jw357f31GO,1,charliehebdo-all-rnr-threads
553493300242432000,#CharlieHebdo on Jazeera : Double standard of freedom of expression  http://t.co/gVjlX2NpAd,0,charliehebdo-all-rnr-threads
553493510306152448,Industrial zone in Dammartin-en-Goël  near Paris  scene of hostage taking and manhunt. More: http://t.co/8zhiaZAshc http://t.co/zCpXy3EN1P,1,charliehebdo-all-rnr-threads
553493707472011264,Special forces stands on the roof of a building in Dammartin-en-Goele where a hostage-taking is underway #AFP http://t.co/gcm7TRRVfd,1,charliehebdo-all-rnr-threads
553493785523400704,Building in Dammartin-en-Goele where #CharlieHebdo suspects believed to be holed up http://t.co/BXIQYIqT0R http://t.co/HSzL3gK9eT,1,charliehebdo-all-rnr-threads
553495137314435072,"Charlie Hebdo killers say they ""want to die like martyrs"". I suspect the French police will be happy to oblige ...",1,charliehebdo-all-rnr-threads
553495922639122432,UPDATE: French police in standoff with #CharlieHebdo attack suspects  hostage believed taken http://t.co/Jzqo5Su0a1 http://t.co/zexuGWcdzd,1,charliehebdo-all-rnr-threads
553496228055777280,Breathtaking. The cover of next week's New Yorker  by Ana Juan #JeSuisCharlie http://t.co/pQzGCnXXyM,0,charliehebdo-all-rnr-threads
553497508970631168,A picture is worth a thousand words.  #JeSuisCharlie  #JeSuisAhmed #JeSuisHumain  #CharlieHebdo  via @Raseef22 http://t.co/EKYcmauf33,0,charliehebdo-all-rnr-threads
553497730476015617,Poor attempt by @bdutt to justify #CharlieHebdo attack  despite the fact that France was first to recognise Palestine http://t.co/e4BBlsWwOp,0,charliehebdo-all-rnr-threads
553497835371757568,historic moment as the #EiffelTower goes dark to unify the world around #CharlieHebdo . #JeSuisCharlie #ParisShooting http://t.co/c5iwqgw6aA,0,charliehebdo-all-rnr-threads
553498106588049408,Wow. @newyorker cover. #charliehebdo http://t.co/7lXstToyKw,0,charliehebdo-all-rnr-threads
553499806883381249,LIVE FEED from scene of standoff between #CharlieHebdo shooting suspects &amp; police http://t.co/Q4kQYO2SHC http://t.co/gcsVG5iAQh,0,charliehebdo-all-rnr-threads
553500238246608896,Gallery: Tank &amp; armoured car seen near #CharlieHebdo seige outside Paris (by @heathcliffom) http://t.co/KAlTe4Fmsd http://t.co/9lyesZgpAL,1,charliehebdo-all-rnr-threads
553500932521336832,Residents of Dammartin-en-Goele told to stay inside  schools on lockdown  mayor's press office tells CNN. http://t.co/7Bxdhozq4H,0,charliehebdo-all-rnr-threads
553501357156876290,"#CharlieHebdo suspects ""prepared to die as martyrs""  they tell police after making contact - French media http://t.co/Qgmn70TXSU",1,charliehebdo-all-rnr-threads
553502180666531840,A person living near the #Dammartin hostage scene sent us these photos #CharlieHebdo #obs http://t.co/FKHD1fGt03,1,charliehebdo-all-rnr-threads
553502311872733184,Field near printers has become a makeshift helicopter pad for airforce and gendarmerie Puma helicopters #charliehebdo http://t.co/O5VQOFpWlV,1,charliehebdo-all-rnr-threads
553502446769942528,Charlie Hebdo killers tell police: 'We are ready to die as martyrs' http://t.co/h4Gp9BAetN http://t.co/MMF4hXUKDd,1,charliehebdo-all-rnr-threads
553502749498036224,"""Yo  Charlie Hebdo  I'm really sad for you  I'ma let you finish  but la best galette of all time is reportée au 17 janvier."" — Balkanye West",0,charliehebdo-all-rnr-threads
553503184174710784,#CharlieHebdo shooting suspects tell police they 'prepared to die as martyrs' - French media http://t.co/G6eunBDIrj http://t.co/jOnfaapehF,1,charliehebdo-all-rnr-threads
553503546382249984,"BREAKING: #CharlieHebdo suspects “almost certainly behind hostage taking "" say officials: http://t.co/qB4b5cKvPg http://t.co/iGJNu386dQ",1,charliehebdo-all-rnr-threads
553503846258196480,‘Muslims don't believe in freedom of speech’ – radical cleric Chaudry http://t.co/or8tYpGCiH #CharlieHebdo http://t.co/W2HAAKOJjQ,0,charliehebdo-all-rnr-threads
553503909692841984,Hundreds of police at siege in Dammartin-en-Goele. Follow our #CharlieHebdo coverage: http://t.co/jMOZXPaSOJ http://t.co/kPAlm9TQwQ,1,charliehebdo-all-rnr-threads
553505371290357761,Charlie Hebdo attack suspects told police by phone they wanted to die as martyrs  French lawmaker tells TV station. http://t.co/7Bxdhozq4H,1,charliehebdo-all-rnr-threads
553505458162782208,What we know about the suspects in the Charlie Hebdo attacks: http://t.co/lgoa0zRIPz http://t.co/zAHS26igzy,0,charliehebdo-all-rnr-threads
553505858811080704,AFP map of the region northeast of Paris where Wednesday's massacre suspects are cornered with hostage http://t.co/H9SwsdTFRf,1,charliehebdo-all-rnr-threads
553506091389440000,→ http://t.co/DVGUfqUEq4 Charlie Hebdo  86 Charlie Hebdo attack: Helicopters hunt for suspects in woods of France http://t.co/8WhrB18Em7,0,charliehebdo-all-rnr-threads
553506337121107968,On Weds Saudi Arabia condemned #CharlieHebdo as 'cowardly attack'. Today they flogged Raif Badawi for encouraging free speech.,0,charliehebdo-all-rnr-threads
